{"batch_manifest_sha256":"081bac30bbb2f1afcad3e4d482d37a7fc532a16c0cdcdf0585aeeca96d104783","classification":"test_particle_wall_loss_not_self_consistent_plasma","confidence_interval_95":[0.8063923194655637,1.0],"coupling_target":"cft-field-plasma-coupling/4.2.0","estimator_policy":"unweighted_binomial","integration_status":"export_only_pending_consumer_integration","orbit_result_artifact_sha256":"a81b358a2021314696b77cb6a3c2320eed8de6b75ea981baf49f01ea61e0a1ed","plasma_network_role":"export_only_pending_integration","probability":1.0,"quantity":"electron_dielectric_wall_loss_probability","result_identity_sha256":"59d6ab093b15a0d16e4af2465eee3049566f7fe2d4eac49634b0a058e31e8a0c","schema_version":"cft-revival-orbit-mc-coupling-v4.2/1.3.0","standard_uncertainty":0.0,"trial_count":16,"verification_status":"deterministic_replay_verified"}