{"batch_manifest_sha256":"5251eee044015501dd5cff01bab49c17eb3e3e27cf0734ec34a30fd04d07a094","classification":"test_particle_wall_loss_not_self_consistent_plasma","confidence_interval_95":[0.9708630437264916,1.0],"coupling_target":"cft-field-plasma-coupling/4.2.0","estimator_policy":"unweighted_binomial","integration_status":"export_only_pending_consumer_integration","orbit_result_artifact_sha256":"32b882c48a08beb92651f731a9f7d5687df494eb6b10f76eff219e3215d42293","plasma_network_role":"export_only_pending_integration","probability":1.0,"quantity":"electron_dielectric_wall_loss_probability","result_identity_sha256":"da8a6fa82120edf10f73186a6aa95e40171d5438d26c12345ba6cf22c2718a58","schema_version":"cft-revival-orbit-mc-coupling-v4.2/1.3.0","standard_uncertainty":0.0,"trial_count":128,"verification_status":"deterministic_replay_verified"}