{"batch_manifest_sha256":"0cef5922e686829f30e79f98cd4984139bd05f6b1bf4d984d057885ad685f44c","classification":"test_particle_wall_loss_not_self_consistent_plasma","confidence_interval_95":[0.6684443704768313,0.8169871513864144],"coupling_target":"cft-field-plasma-coupling/4.2.0","estimator_policy":"unweighted_binomial","integration_status":"export_only_pending_consumer_integration","orbit_result_artifact_sha256":"8dd9db61edc46e5a13a73e54e7b34380a0d114c16aac9ed0c2332c151f935e39","plasma_network_role":"export_only_pending_integration","probability":0.75,"quantity":"electron_dielectric_wall_loss_probability","result_identity_sha256":"795a5bb5f239746be02dcd041a105cadf2e789054d0acbcf86e00eec1c90d5e5","schema_version":"cft-revival-orbit-mc-coupling-v4.2/1.3.0","standard_uncertainty":0.038273277230987154,"trial_count":128,"verification_status":"deterministic_replay_verified"}