{"batch_manifest_sha256":"9cbf939113863ee2fd804976e8b93c26238b8387fb35899490de3c4fb0de47ee","classification":"test_particle_wall_loss_not_self_consistent_plasma","confidence_interval_95":[0.8063923194655637,1.0],"coupling_target":"cft-field-plasma-coupling/4.2.0","estimator_policy":"unweighted_binomial","integration_status":"export_only_pending_consumer_integration","orbit_result_artifact_sha256":"e0dbf926ac0838adcafd9c9376020b1244703c0520aca9e341a07daf37a748bd","plasma_network_role":"export_only_pending_integration","probability":1.0,"quantity":"electron_dielectric_wall_loss_probability","result_identity_sha256":"5c6a5929da7eaf2c8556e9ec74dba3b83e8ee627a87d69c325aef87bb87f6a6c","schema_version":"cft-revival-orbit-mc-coupling-v4.2/1.3.0","standard_uncertainty":0.0,"trial_count":16,"verification_status":"deterministic_replay_verified"}