{"batch_manifest_sha256":"9c1abd0ad2a27d7fa733c25a6d01bb4190b10f1939af35a4109698337ec47627","classification":"test_particle_wall_loss_not_self_consistent_plasma","confidence_interval_95":[0.6189947723495539,0.7754183391643332],"coupling_target":"cft-field-plasma-coupling/4.2.0","estimator_policy":"unweighted_binomial","integration_status":"export_only_pending_consumer_integration","orbit_result_artifact_sha256":"3a34060de247dd329d8aaa0a089755706353cfcd13b1b3b54c26b66262803398","plasma_network_role":"export_only_pending_integration","probability":0.703125,"quantity":"electron_dielectric_wall_loss_probability","result_identity_sha256":"d8ba511a16ef81f396db9b9edc4530a460c0c56caa51d0796ce3a2ae580a9056","schema_version":"cft-revival-orbit-mc-coupling-v4.2/1.3.0","standard_uncertainty":0.04038295532838932,"trial_count":128,"verification_status":"deterministic_replay_verified"}