{"batch_manifest_sha256":"0c6a402c9c12a616cebfccb23cb1739380177294d9dad3e0e554e17798acd09e","classification":"test_particle_wall_loss_not_self_consistent_plasma","confidence_interval_95":[0.9708630437264916,1.0],"coupling_target":"cft-field-plasma-coupling/4.2.0","estimator_policy":"unweighted_binomial","integration_status":"export_only_pending_consumer_integration","orbit_result_artifact_sha256":"79ce03f9f4af4e6e1621f806fdc5607a25742cd391c58115d9f0999ec2e5992d","plasma_network_role":"export_only_pending_integration","probability":1.0,"quantity":"electron_dielectric_wall_loss_probability","result_identity_sha256":"56a5241e855107c79e4e102585da4b86b87877c620b1ca9167fc09503343376a","schema_version":"cft-revival-orbit-mc-coupling-v4.2/1.3.0","standard_uncertainty":0.0,"trial_count":128,"verification_status":"deterministic_replay_verified"}