{"batch_manifest_sha256":"ce639ca367fcbaaa700d718264abc6c55ee2b26000e356736f9749adf6afdea8","classification":"test_particle_wall_loss_not_self_consistent_plasma","confidence_interval_95":[0.18986902089941152,0.3398691922955691],"coupling_target":"cft-field-plasma-coupling/4.2.0","estimator_policy":"unweighted_binomial","integration_status":"export_only_pending_consumer_integration","orbit_result_artifact_sha256":"4842dc27797c19a80c565c2d6d26c97fff9b9ae518b2326887c6acdbb87c69ab","plasma_network_role":"export_only_pending_integration","probability":0.2578125,"quantity":"electron_dielectric_wall_loss_probability","result_identity_sha256":"8ee445dac7c28adfadd3617e290589e74dc65b9a27033cb5870c9cb68e19397d","schema_version":"cft-revival-orbit-mc-coupling-v4.2/1.3.0","standard_uncertainty":0.03866373612271319,"trial_count":128,"verification_status":"deterministic_replay_verified"}