{"batch_manifest_sha256":"a1e66d2809b2d88c536dea2a2f976e9197afac9651c8c79a03ae2208251c4028","classification":"test_particle_wall_loss_not_self_consistent_plasma","confidence_interval_95":[0.8063923194655637,1.0],"coupling_target":"cft-field-plasma-coupling/4.2.0","estimator_policy":"unweighted_binomial","integration_status":"export_only_pending_consumer_integration","orbit_result_artifact_sha256":"7d308145d97aa1ea68950a7cbc939d9283af6966659bf3b2ef3f89eea8e51ae6","plasma_network_role":"export_only_pending_integration","probability":1.0,"quantity":"electron_dielectric_wall_loss_probability","result_identity_sha256":"812c24fe56342a862171873c1b20ac4d3066bed1f83eec9061a422759b3a6181","schema_version":"cft-revival-orbit-mc-coupling-v4.2/1.3.0","standard_uncertainty":0.0,"trial_count":16,"verification_status":"deterministic_replay_verified"}