{"batch_manifest_sha256":"fc450d5f75cad34cc6a1e9a2b934a99b1116b52e8f771d1cfd3f14c9faed8951","classification":"test_particle_wall_loss_not_self_consistent_plasma","confidence_interval_95":[0.47598101173634194,0.6453768687294696],"coupling_target":"cft-field-plasma-coupling/4.2.0","estimator_policy":"unweighted_binomial","integration_status":"export_only_pending_consumer_integration","orbit_result_artifact_sha256":"3b052dbf6bb3ea3549d7adafdde6ba49700cc9c6bf2114596c3ca56be71e8a6d","plasma_network_role":"export_only_pending_integration","probability":0.5625,"quantity":"electron_dielectric_wall_loss_probability","result_identity_sha256":"431d988b5a5d774f1276bfed2eef3a526ba5d42b6efd1cdd5f5b09a1f5e4c0ca","schema_version":"cft-revival-orbit-mc-coupling-v4.2/1.3.0","standard_uncertainty":0.04384754750125713,"trial_count":128,"verification_status":"deterministic_replay_verified"}