{"batch_manifest_sha256":"7891879a1e5a31d89bf5710439357b7f65cdcdc3a5ae9fc4db265239b7b9ab5d","classification":"test_particle_wall_loss_not_self_consistent_plasma","confidence_interval_95":[0.9708630437264916,1.0],"coupling_target":"cft-field-plasma-coupling/4.2.0","estimator_policy":"unweighted_binomial","integration_status":"export_only_pending_consumer_integration","orbit_result_artifact_sha256":"a34c14766df7979e8efda0db9995a5ed2863d063d88bd0bd143a870e4edb7417","plasma_network_role":"export_only_pending_integration","probability":1.0,"quantity":"electron_dielectric_wall_loss_probability","result_identity_sha256":"78fe6050e1152ea939d732006d1a36d1ea8b350ab3542b59913a799c4e0e837a","schema_version":"cft-revival-orbit-mc-coupling-v4.2/1.3.0","standard_uncertainty":0.0,"trial_count":128,"verification_status":"deterministic_replay_verified"}