{"batch_manifest_sha256":"607b4dbce80a63f8af06f2c410351b313531b5a4a4a2937fc4e23be28011e80b","classification":"test_particle_wall_loss_not_self_consistent_plasma","confidence_interval_95":[0.41465224626050723,0.5853477537394928],"coupling_target":"cft-field-plasma-coupling/4.2.0","estimator_policy":"unweighted_binomial","integration_status":"export_only_pending_consumer_integration","orbit_result_artifact_sha256":"e0313c3005f5f8bf58aa39edb2e797d104fdab1d9df009eb02a6ad51d62ec3c0","plasma_network_role":"export_only_pending_integration","probability":0.5,"quantity":"electron_dielectric_wall_loss_probability","result_identity_sha256":"96f178f4b4df2bf4fdb1fa1310911ea5a78a9bd19c1ff257d80b19c66747dd0e","schema_version":"cft-revival-orbit-mc-coupling-v4.2/1.3.0","standard_uncertainty":0.04419417382415922,"trial_count":128,"verification_status":"deterministic_replay_verified"}