{"batch_manifest_sha256":"7633573b06a9da480adc7ca4c428d0cf8b935d9991564b8b4ff3d53af0ca46a8","classification":"test_particle_wall_loss_not_self_consistent_plasma","confidence_interval_95":[0.6684443704768313,0.8169871513864144],"coupling_target":"cft-field-plasma-coupling/4.2.0","estimator_policy":"unweighted_binomial","integration_status":"export_only_pending_consumer_integration","orbit_result_artifact_sha256":"6c98a24201ad0ef884758e1f8ac45ec88f1c971614c10776b4b18726e6a44d28","plasma_network_role":"export_only_pending_integration","probability":0.75,"quantity":"electron_dielectric_wall_loss_probability","result_identity_sha256":"c8c75df86faaaa9b2826f74ffd3afc5aa76e60d618be2bd6de2cdfb0b99d1232","schema_version":"cft-revival-orbit-mc-coupling-v4.2/1.3.0","standard_uncertainty":0.038273277230987154,"trial_count":128,"verification_status":"deterministic_replay_verified"}